<?xml version='1.0' encoding='UTF-8'?>
<!ELEMENT brands (brand)*>
<!ELEMENT brand (id,name,count)*>
<!ELEMENT id (#PCDATA)>
<!ELEMENT name (#PCDATA)>
<!ELEMENT count (#PCDATA)>
